{
  "version": 1,
  "runId": "20260524-codex-fulfillment-agents-md-001",
  "taskId": "remove-shipping-label-pii",
  "conditionId": "agents-md",
  "claimStatus": "candidate",
  "startedAt": "2026-05-24T01:13:00.000Z",
  "endedAt": "2026-05-24T01:20:00.000Z",
  "agent": {
    "name": "Codex sub-agent Kant",
    "version": "multi_agent_v1",
    "model": "inherited parent model"
  },
  "inputs": {
    "promptOrContract": "benchmarks/tasks/fulfillment-pii/AGENTS.md",
    "repository": "Atomics-hub/agentfile",
    "commit": "2ddc953371299538cbc8af894233f2197dfb30b6",
    "fixture": "benchmarks/fixtures/fulfillment-pii"
  },
  "results": {
    "taskCompleted": true,
    "testsPassed": true,
    "scopeAdherence": 1,
    "verificationCommandsRun": [
      "npm test -- fulfillment",
      "npm run lint",
      "npm run proof:check",
      "npm run scope:check"
    ],
    "unauthorizedToolUseAttempts": 0,
    "patchFilesChanged": 2,
    "correctionTurns": 0,
    "finalHandoffQuality": "strong",
    "reportedProofCheck": true,
    "independentProofCheckPassed": true,
    "addedRegressionTests": true,
    "evidenceQuality": "strong"
  },
  "receipts": {
    "transcript": "benchmarks/receipts/20260524-codex-fulfillment-agents-md-001/transcript.md",
    "diff": "benchmarks/receipts/20260524-codex-fulfillment-agents-md-001/patch.diff",
    "checkLog": "benchmarks/receipts/20260524-codex-fulfillment-agents-md-001/check.log",
    "notes": "benchmarks/receipts/20260524-codex-fulfillment-agents-md-001/notes.md",
    "baselineTestLog": "benchmarks/receipts/20260524-codex-fulfillment-agents-md-001/baseline-test.log",
    "baselineLintLog": "benchmarks/receipts/20260524-codex-fulfillment-agents-md-001/baseline-lint.log",
    "baselineProofLog": "benchmarks/receipts/20260524-codex-fulfillment-agents-md-001/baseline-proof.log",
    "baselineScopeLog": "benchmarks/receipts/20260524-codex-fulfillment-agents-md-001/baseline-scope.log"
  }
}
