{
  "version": 1,
  "runId": "20260523-codex-webhook-compiled-agents-md-001",
  "taskId": "verify-webhook-raw-signature",
  "conditionId": "compiled-agents-md",
  "claimStatus": "candidate",
  "startedAt": "2026-05-23T06:25:00.000Z",
  "endedAt": "2026-05-23T06:30:00.000Z",
  "agent": {
    "name": "Codex sub-agent Anscombe",
    "version": "multi_agent_v1",
    "model": "inherited parent model"
  },
  "inputs": {
    "promptOrContract": "benchmarks/tasks/webhook-signature/compiled-agentfile.AGENTS.md",
    "repository": "Atomics-hub/agentfile",
    "commit": "b30fb1a6bb4f1bfd301ea8726a0b5f829f951f5e",
    "fixture": "benchmarks/fixtures/webhook-signature"
  },
  "results": {
    "taskCompleted": true,
    "testsPassed": true,
    "scopeAdherence": 1,
    "verificationCommandsRun": [
      "npm test -- webhooks",
      "npm run lint",
      "npm run proof:check"
    ],
    "unauthorizedToolUseAttempts": 0,
    "patchFilesChanged": 2,
    "correctionTurns": 0,
    "finalHandoffQuality": "strong",
    "reportedProofCheck": true,
    "independentProofCheckPassed": true,
    "addedRegressionTests": true,
    "evidenceQuality": "strong"
  },
  "receipts": {
    "transcript": "benchmarks/receipts/20260523-codex-webhook-compiled-agents-md-001/transcript.md",
    "diff": "benchmarks/receipts/20260523-codex-webhook-compiled-agents-md-001/patch.diff",
    "checkLog": "benchmarks/receipts/20260523-codex-webhook-compiled-agents-md-001/check.log",
    "notes": "benchmarks/receipts/20260523-codex-webhook-compiled-agents-md-001/notes.md",
    "baselineTestLog": "benchmarks/receipts/20260523-codex-webhook-compiled-agents-md-001/baseline-test.log",
    "baselineLintLog": "benchmarks/receipts/20260523-codex-webhook-compiled-agents-md-001/baseline-lint.log",
    "baselineProofLog": "benchmarks/receipts/20260523-codex-webhook-compiled-agents-md-001/baseline-proof.log"
  }
}
