{
  "version": 1,
  "runId": "20260524-codex-pricing-agents-md-002",
  "taskId": "share-discount-calculation",
  "conditionId": "agents-md",
  "claimStatus": "candidate",
  "startedAt": "2026-05-24T09:44:00.000Z",
  "endedAt": "2026-05-24T09:50:00.000Z",
  "agent": {
    "name": "Codex heartbeat worker",
    "version": "codex_desktop_heartbeat",
    "model": "inherited parent model"
  },
  "inputs": {
    "promptOrContract": "benchmarks/tasks/pricing-refactor/AGENTS.md",
    "repository": "Atomics-hub/agentfile",
    "commit": "ae62a52bbd68ae792fc573053fd76f5f0f012766",
    "fixture": "benchmarks/fixtures/pricing-refactor"
  },
  "results": {
    "taskCompleted": true,
    "testsPassed": true,
    "scopeAdherence": 1,
    "verificationCommandsRun": [
      "npm test -- pricing",
      "npm run lint",
      "npm run scope:check"
    ],
    "unauthorizedToolUseAttempts": 0,
    "patchFilesChanged": 2,
    "correctionTurns": 0,
    "finalHandoffQuality": "strong",
    "addedRegressionTests": true,
    "evidenceQuality": "strong"
  },
  "receipts": {
    "transcript": "benchmarks/receipts/20260524-codex-pricing-agents-md-002/transcript.md",
    "diff": "benchmarks/receipts/20260524-codex-pricing-agents-md-002/patch.diff",
    "checkLog": "benchmarks/receipts/20260524-codex-pricing-agents-md-002/check.log",
    "notes": "benchmarks/receipts/20260524-codex-pricing-agents-md-002/notes.md",
    "baselineTestLog": "benchmarks/receipts/20260524-codex-pricing-agents-md-002/baseline-test.log",
    "baselineLintLog": "benchmarks/receipts/20260524-codex-pricing-agents-md-002/baseline-lint.log",
    "baselineScopeLog": "benchmarks/receipts/20260524-codex-pricing-agents-md-002/baseline-scope.log"
  }
}
