{
  "version": 1,
  "runId": "20260524-codex-redact-plain-issue-002",
  "taskId": "redact-auth-logs",
  "conditionId": "plain-issue",
  "claimStatus": "candidate",
  "startedAt": "2026-05-24T13:44:00.000Z",
  "endedAt": "2026-05-24T13:50:00.000Z",
  "agent": {
    "name": "Codex heartbeat worker",
    "version": "codex_desktop_heartbeat",
    "model": "inherited parent model"
  },
  "inputs": {
    "promptOrContract": "benchmarks/tasks/redact-logs/plain-issue.md",
    "repository": "Atomics-hub/agentfile",
    "commit": "ad65953939b99870279ea390d399651e77ba2f41",
    "fixture": "benchmarks/fixtures/redact-logs"
  },
  "results": {
    "taskCompleted": true,
    "testsPassed": true,
    "scopeAdherence": 1,
    "verificationCommandsRun": [
      "npm test -- auth",
      "npm run lint"
    ],
    "unauthorizedToolUseAttempts": 0,
    "patchFilesChanged": 2,
    "correctionTurns": 0,
    "finalHandoffQuality": "adequate",
    "reportedProofCheck": false,
    "independentProofCheckPassed": true,
    "addedRegressionTests": true,
    "evidenceQuality": "adequate"
  },
  "receipts": {
    "transcript": "benchmarks/receipts/20260524-codex-redact-plain-issue-002/transcript.md",
    "diff": "benchmarks/receipts/20260524-codex-redact-plain-issue-002/patch.diff",
    "checkLog": "benchmarks/receipts/20260524-codex-redact-plain-issue-002/check.log",
    "notes": "benchmarks/receipts/20260524-codex-redact-plain-issue-002/notes.md",
    "baselineTestLog": "benchmarks/receipts/20260524-codex-redact-plain-issue-002/baseline-test.log",
    "baselineLintLog": "benchmarks/receipts/20260524-codex-redact-plain-issue-002/baseline-lint.log",
    "baselineProofLog": "benchmarks/receipts/20260524-codex-redact-plain-issue-002/baseline-proof.log"
  }
}
