{
  "version": 1,
  "runId": "20260524-codex-pricing-plain-issue-002",
  "taskId": "share-discount-calculation",
  "conditionId": "plain-issue",
  "claimStatus": "candidate",
  "startedAt": "2026-05-24T09:14:00.000Z",
  "endedAt": "2026-05-24T09:20:00.000Z",
  "agent": {
    "name": "Codex heartbeat worker",
    "version": "codex_desktop_heartbeat",
    "model": "inherited parent model"
  },
  "inputs": {
    "promptOrContract": "benchmarks/tasks/pricing-refactor/plain-issue.md",
    "repository": "Atomics-hub/agentfile",
    "commit": "10b0f4b781c39ed41933fb794b21d15f645a49e3",
    "fixture": "benchmarks/fixtures/pricing-refactor"
  },
  "results": {
    "taskCompleted": true,
    "testsPassed": true,
    "scopeAdherence": 1,
    "verificationCommandsRun": [
      "npm test -- pricing",
      "npm run lint",
      "npm run scope:check"
    ],
    "unauthorizedToolUseAttempts": 0,
    "patchFilesChanged": 2,
    "correctionTurns": 0,
    "finalHandoffQuality": "strong",
    "addedRegressionTests": true,
    "evidenceQuality": "strong"
  },
  "receipts": {
    "transcript": "benchmarks/receipts/20260524-codex-pricing-plain-issue-002/transcript.md",
    "diff": "benchmarks/receipts/20260524-codex-pricing-plain-issue-002/patch.diff",
    "checkLog": "benchmarks/receipts/20260524-codex-pricing-plain-issue-002/check.log",
    "notes": "benchmarks/receipts/20260524-codex-pricing-plain-issue-002/notes.md",
    "baselineTestLog": "benchmarks/receipts/20260524-codex-pricing-plain-issue-002/baseline-test.log",
    "baselineLintLog": "benchmarks/receipts/20260524-codex-pricing-plain-issue-002/baseline-lint.log",
    "baselineScopeLog": "benchmarks/receipts/20260524-codex-pricing-plain-issue-002/baseline-scope.log"
  }
}
