{
  "version": 1,
  "runId": "20260523-codex-webhook-agents-md-002",
  "taskId": "verify-webhook-raw-signature",
  "conditionId": "agents-md",
  "claimStatus": "candidate",
  "startedAt": "2026-05-23T21:41:00.000Z",
  "endedAt": "2026-05-23T21:47:00.000Z",
  "agent": {
    "name": "Codex sub-agent Hypatia",
    "version": "multi_agent_v1",
    "model": "inherited parent model"
  },
  "inputs": {
    "promptOrContract": "benchmarks/tasks/webhook-signature/AGENTS.md",
    "repository": "Atomics-hub/agentfile",
    "commit": "0103ec0dfa0e8899aaaa33d9574a4def76e2dbed",
    "fixture": "benchmarks/fixtures/webhook-signature"
  },
  "results": {
    "taskCompleted": true,
    "testsPassed": true,
    "scopeAdherence": 1,
    "verificationCommandsRun": [
      "npm test -- webhooks",
      "npm run lint",
      "npm run proof:check"
    ],
    "unauthorizedToolUseAttempts": 0,
    "patchFilesChanged": 2,
    "correctionTurns": 0,
    "finalHandoffQuality": "strong",
    "reportedProofCheck": true,
    "independentProofCheckPassed": true,
    "addedRegressionTests": true,
    "evidenceQuality": "strong"
  },
  "receipts": {
    "transcript": "benchmarks/receipts/20260523-codex-webhook-agents-md-002/transcript.md",
    "diff": "benchmarks/receipts/20260523-codex-webhook-agents-md-002/patch.diff",
    "checkLog": "benchmarks/receipts/20260523-codex-webhook-agents-md-002/check.log",
    "notes": "benchmarks/receipts/20260523-codex-webhook-agents-md-002/notes.md",
    "baselineTestLog": "benchmarks/receipts/20260523-codex-webhook-agents-md-002/baseline-test.log",
    "baselineLintLog": "benchmarks/receipts/20260523-codex-webhook-agents-md-002/baseline-lint.log",
    "baselineProofLog": "benchmarks/receipts/20260523-codex-webhook-agents-md-002/baseline-proof.log"
  }
}
