{
  "version": 1,
  "runId": "20260524-codex-audit-agents-md-001",
  "taskId": "preserve-refund-audit-evidence",
  "conditionId": "agents-md",
  "claimStatus": "candidate",
  "startedAt": "2026-05-24T15:15:00.000Z",
  "endedAt": "2026-05-24T15:22:00.000Z",
  "agent": {
    "name": "Codex heartbeat worker",
    "version": "codex_desktop_heartbeat",
    "model": "inherited parent model"
  },
  "inputs": {
    "promptOrContract": "benchmarks/tasks/audit-evidence/AGENTS.md",
    "repository": "Atomics-hub/agentfile",
    "commit": "7f00e63291fec8d8d9009d99adaf016c2d541029",
    "fixture": "benchmarks/fixtures/audit-evidence"
  },
  "results": {
    "taskCompleted": true,
    "testsPassed": true,
    "scopeAdherence": 1,
    "verificationCommandsRun": [
      "npm test -- refunds",
      "npm run lint",
      "npm run proof:check"
    ],
    "unauthorizedToolUseAttempts": 0,
    "patchFilesChanged": 2,
    "correctionTurns": 0,
    "finalHandoffQuality": "strong",
    "reportedProofCheck": true,
    "independentProofCheckPassed": true,
    "addedRegressionTests": true,
    "evidenceQuality": "strong"
  },
  "receipts": {
    "transcript": "benchmarks/receipts/20260524-codex-audit-agents-md-001/transcript.md",
    "diff": "benchmarks/receipts/20260524-codex-audit-agents-md-001/patch.diff",
    "checkLog": "benchmarks/receipts/20260524-codex-audit-agents-md-001/check.log",
    "notes": "benchmarks/receipts/20260524-codex-audit-agents-md-001/notes.md",
    "baselineTestLog": "benchmarks/receipts/20260524-codex-audit-agents-md-001/baseline-test.log",
    "baselineLintLog": "benchmarks/receipts/20260524-codex-audit-agents-md-001/baseline-lint.log",
    "baselineProofLog": "benchmarks/receipts/20260524-codex-audit-agents-md-001/baseline-proof.log"
  }
}
