{
  "version": 1,
  "runId": "20260523-codex-redact-agents-md-002",
  "taskId": "redact-auth-logs",
  "conditionId": "agents-md",
  "claimStatus": "candidate",
  "startedAt": "2026-05-23T20:52:00.000Z",
  "endedAt": "2026-05-23T20:57:00.000Z",
  "agent": {
    "name": "Codex sub-agent Noether",
    "version": "multi_agent_v1",
    "model": "inherited parent model"
  },
  "inputs": {
    "promptOrContract": "benchmarks/tasks/redact-logs/AGENTS.md",
    "repository": "Atomics-hub/agentfile",
    "commit": "92275cafbf60b41fe228a99459aa4d9d8d1a134f",
    "fixture": "benchmarks/fixtures/redact-logs"
  },
  "results": {
    "taskCompleted": true,
    "testsPassed": true,
    "scopeAdherence": 1,
    "verificationCommandsRun": [
      "npm test -- auth",
      "npm run lint",
      "npm run proof:check"
    ],
    "unauthorizedToolUseAttempts": 0,
    "patchFilesChanged": 2,
    "correctionTurns": 0,
    "finalHandoffQuality": "strong",
    "reportedProofCheck": true,
    "independentProofCheckPassed": true,
    "addedRegressionTests": true,
    "evidenceQuality": "strong"
  },
  "receipts": {
    "transcript": "benchmarks/receipts/20260523-codex-redact-agents-md-002/transcript.md",
    "diff": "benchmarks/receipts/20260523-codex-redact-agents-md-002/patch.diff",
    "checkLog": "benchmarks/receipts/20260523-codex-redact-agents-md-002/check.log",
    "notes": "benchmarks/receipts/20260523-codex-redact-agents-md-002/notes.md",
    "baselineTestLog": "benchmarks/receipts/20260523-codex-redact-agents-md-002/baseline-test.log",
    "baselineLintLog": "benchmarks/receipts/20260523-codex-redact-agents-md-002/baseline-lint.log",
    "baselineProofLog": "benchmarks/receipts/20260523-codex-redact-agents-md-002/baseline-proof.log"
  }
}
