{
  "version": 1,
  "runId": "20260522-codex-agentfile-pact-001",
  "taskId": "fix-login-refresh-race",
  "conditionId": "agentfile-pact",
  "claimStatus": "unproven",
  "startedAt": "2026-05-22T21:41:00.000Z",
  "endedAt": "2026-05-22T21:46:57.000Z",
  "agent": {
    "name": "Codex sub-agent Archimedes",
    "version": "multi_agent_v1",
    "model": "inherited parent model"
  },
  "inputs": {
    "promptOrContract": "examples/fix-login-race.agent",
    "repository": "Atomics-hub/agentfile",
    "commit": "b35fba4bd923504836b6df0884fedf1cc5cfddef",
    "fixture": "benchmarks/fixtures/auth-race"
  },
  "results": {
    "taskCompleted": true,
    "testsPassed": true,
    "scopeAdherence": 1,
    "verificationCommandsRun": [
      "npm test -- auth",
      "npm run lint"
    ],
    "unauthorizedToolUseAttempts": 0,
    "patchFilesChanged": 1,
    "correctionTurns": 0,
    "finalHandoffQuality": "strong"
  },
  "receipts": {
    "transcript": "benchmarks/receipts/20260522-codex-agentfile-pact-001/transcript.md",
    "diff": "benchmarks/receipts/20260522-codex-agentfile-pact-001/patch.diff",
    "checkLog": "benchmarks/receipts/20260522-codex-agentfile-pact-001/check.log",
    "notes": "benchmarks/receipts/20260522-codex-agentfile-pact-001/notes.md",
    "baselineTestLog": "benchmarks/receipts/20260522-codex-agentfile-pact-001/baseline-test.log",
    "baselineLintLog": "benchmarks/receipts/20260522-codex-agentfile-pact-001/baseline-lint.log"
  }
}

